{"series":[{"system_id":"tor-bikeshare","month":"2016-07","member":66007,"casual":41512,"other":0,"unlabelled":0,"trips":107519},{"system_id":"tor-bikeshare","month":"2016-08","member":84639,"casual":45862,"other":0,"unlabelled":0,"trips":130501},{"system_id":"tor-bikeshare","month":"2016-09","member":94967,"casual":35066,"other":0,"unlabelled":0,"trips":130033},{"system_id":"tor-bikeshare","month":"2016-10","member":83560,"casual":17725,"other":0,"unlabelled":0,"trips":101285},{"system_id":"tor-bikeshare","month":"2016-11","member":72444,"casual":7152,"other":0,"unlabelled":0,"trips":79596},{"system_id":"tor-bikeshare","month":"2016-12","member":34902,"casual":1393,"other":0,"unlabelled":0,"trips":36295},{"system_id":"tor-bikeshare","month":"2017-01","member":39948,"casual":1460,"other":0,"unlabelled":0,"trips":41408},{"system_id":"tor-bikeshare","month":"2017-02","member":38986,"casual":2809,"other":0,"unlabelled":0,"trips":41795},{"system_id":"tor-bikeshare","month":"2017-03","member":46598,"casual":2338,"other":0,"unlabelled":0,"trips":48936},{"system_id":"tor-bikeshare","month":"2017-04","member":64515,"casual":14515,"other":0,"unlabelled":0,"trips":79030},{"system_id":"tor-bikeshare","month":"2017-05","member":84817,"casual":20497,"other":0,"unlabelled":0,"trips":105314},{"system_id":"tor-bikeshare","month":"2017-06","member":112374,"casual":36543,"other":0,"unlabelled":0,"trips":148917},{"system_id":"tor-bikeshare","month":"2017-07","member":133747,"casual":79857,"other":0,"unlabelled":0,"trips":213604},{"system_id":"tor-bikeshare","month":"2017-08","member":153341,"casual":70137,"other":0,"unlabelled":0,"trips":223478},{"system_id":"tor-bikeshare","month":"2017-09","member":168122,"casual":58284,"other":0,"unlabelled":0,"trips":226406},{"system_id":"tor-bikeshare","month":"2017-10","member":153806,"casual":31770,"other":0,"unlabelled":0,"trips":185576},{"system_id":"tor-bikeshare","month":"2017-11","member":111871,"casual":6842,"other":0,"unlabelled":0,"trips":118713},{"system_id":"tor-bikeshare","month":"2017-12","member":56586,"casual":2530,"other":0,"unlabelled":0,"trips":59116},{"system_id":"tor-bikeshare","month":"2018-01","member":42469,"casual":1390,"other":0,"unlabelled":0,"trips":43859},{"system_id":"tor-bikeshare","month":"2018-02","member":47276,"casual":2455,"other":0,"unlabelled":0,"trips":49731},{"system_id":"tor-bikeshare","month":"2018-03","member":78564,"casual":6405,"other":0,"unlabelled":0,"trips":84969},{"system_id":"tor-bikeshare","month":"2018-04","member":82194,"casual":12589,"other":0,"unlabelled":0,"trips":94783},{"system_id":"tor-bikeshare","month":"2018-05","member":160989,"casual":51761,"other":0,"unlabelled":0,"trips":212750},{"system_id":"tor-bikeshare","month":"2018-06","member":186463,"casual":64374,"other":0,"unlabelled":0,"trips":250837},{"system_id":"tor-bikeshare","month":"2018-07","member":215835,"casual":70481,"other":0,"unlabelled":0,"trips":286316},{"system_id":"tor-bikeshare","month":"2018-08","member":209770,"casual":71449,"other":0,"unlabelled":0,"trips":281219},{"system_id":"tor-bikeshare","month":"2018-09","member":207789,"casual":47212,"other":0,"unlabelled":0,"trips":255001},{"system_id":"tor-bikeshare","month":"2018-10","member":160326,"casual":15553,"other":0,"unlabelled":0,"trips":175879},{"system_id":"tor-bikeshare","month":"2018-11","member":100675,"casual":3612,"other":0,"unlabelled":0,"trips":104287},{"system_id":"tor-bikeshare","month":"2018-12","member":80630,"casual":2694,"other":0,"unlabelled":0,"trips":83324},{"system_id":"tor-bikeshare","month":"2019-01","member":59520,"casual":1942,"other":0,"unlabelled":0,"trips":61462},{"system_id":"tor-bikeshare","month":"2019-02","member":38971,"casual":1087,"other":0,"unlabelled":0,"trips":40058},{"system_id":"tor-bikeshare","month":"2019-03","member":82200,"casual":5343,"other":0,"unlabelled":0,"trips":87543},{"system_id":"tor-bikeshare","month":"2019-04","member":123931,"casual":21220,"other":0,"unlabelled":0,"trips":145151},{"system_id":"tor-bikeshare","month":"2019-05","member":164632,"casual":49984,"other":0,"unlabelled":0,"trips":214616},{"system_id":"tor-bikeshare","month":"2019-06","member":200546,"casual":91372,"other":0,"unlabelled":0,"trips":291918},{"system_id":"tor-bikeshare","month":"2019-07","member":260423,"casual":121813,"other":0,"unlabelled":0,"trips":382236},{"system_id":"tor-bikeshare","month":"2019-08","member":262622,"casual":154773,"other":0,"unlabelled":0,"trips":417395},{"system_id":"tor-bikeshare","month":"2019-09","member":252013,"casual":78709,"other":0,"unlabelled":0,"trips":330722},{"system_id":"tor-bikeshare","month":"2019-10","member":208916,"casual":39741,"other":0,"unlabelled":0,"trips":248657},{"system_id":"tor-bikeshare","month":"2019-11","member":127939,"casual":9431,"other":0,"unlabelled":0,"trips":137370},{"system_id":"tor-bikeshare","month":"2019-12","member":77678,"casual":4711,"other":0,"unlabelled":0,"trips":82389},{"system_id":"tor-bikeshare","month":"2020-01","member":97559,"casual":4589,"other":0,"unlabelled":0,"trips":102148},{"system_id":"tor-bikeshare","month":"2020-02","member":85725,"casual":9458,"other":0,"unlabelled":0,"trips":95183},{"system_id":"tor-bikeshare","month":"2020-03","member":87952,"casual":17094,"other":0,"unlabelled":0,"trips":105046},{"system_id":"tor-bikeshare","month":"2020-04","member":52434,"casual":19345,"other":0,"unlabelled":0,"trips":71779},{"system_id":"tor-bikeshare","month":"2020-05","member":100993,"casual":95231,"other":0,"unlabelled":0,"trips":196224},{"system_id":"tor-bikeshare","month":"2020-06","member":189698,"casual":180773,"other":0,"unlabelled":0,"trips":370471},{"system_id":"tor-bikeshare","month":"2020-07","member":258728,"casual":200156,"other":0,"unlabelled":0,"trips":458884},{"system_id":"tor-bikeshare","month":"2020-08","member":293513,"casual":200955,"other":0,"unlabelled":0,"trips":494468},{"system_id":"tor-bikeshare","month":"2020-09","member":282011,"casual":158651,"other":0,"unlabelled":0,"trips":440662},{"system_id":"tor-bikeshare","month":"2020-10","member":206643,"casual":70947,"other":0,"unlabelled":0,"trips":277590},{"system_id":"tor-bikeshare","month":"2020-11","member":143625,"casual":59631,"other":0,"unlabelled":0,"trips":203256},{"system_id":"tor-bikeshare","month":"2020-12","member":73228,"casual":22120,"other":0,"unlabelled":0,"trips":95348},{"system_id":"tor-bikeshare","month":"2021-01","member":61468,"casual":24903,"other":0,"unlabelled":0,"trips":86371},{"system_id":"tor-bikeshare","month":"2021-02","member":53057,"casual":5822,"other":0,"unlabelled":0,"trips":58879},{"system_id":"tor-bikeshare","month":"2021-03","member":122214,"casual":35183,"other":0,"unlabelled":0,"trips":157397},{"system_id":"tor-bikeshare","month":"2021-04","member":150666,"casual":73633,"other":0,"unlabelled":0,"trips":224299},{"system_id":"tor-bikeshare","month":"2021-05","member":240101,"casual":183922,"other":0,"unlabelled":0,"trips":424023},{"system_id":"tor-bikeshare","month":"2021-06","member":297153,"casual":155494,"other":0,"unlabelled":0,"trips":452647},{"system_id":"tor-bikeshare","month":"2021-07","member":292096,"casual":171814,"other":0,"unlabelled":0,"trips":463910},{"system_id":"tor-bikeshare","month":"2021-08","member":306173,"casual":190770,"other":0,"unlabelled":0,"trips":496943},{"system_id":"tor-bikeshare","month":"2021-09","member":287868,"casual":166920,"other":0,"unlabelled":0,"trips":454788},{"system_id":"tor-bikeshare","month":"2024-01","member":190402,"casual":14477,"other":0,"unlabelled":0,"trips":204879},{"system_id":"tor-bikeshare","month":"2024-02","member":238173,"casual":23601,"other":0,"unlabelled":0,"trips":261774},{"system_id":"tor-bikeshare","month":"2024-03","member":279583,"casual":33030,"other":0,"unlabelled":0,"trips":312613},{"system_id":"tor-bikeshare","month":"2024-04","member":344854,"casual":58934,"other":0,"unlabelled":0,"trips":403788},{"system_id":"tor-bikeshare","month":"2024-05","member":526201,"casual":160191,"other":0,"unlabelled":0,"trips":686392},{"system_id":"tor-bikeshare","month":"2024-06","member":573257,"casual":193611,"other":0,"unlabelled":0,"trips":766868},{"system_id":"tor-bikeshare","month":"2024-07","member":641196,"casual":265176,"other":0,"unlabelled":0,"trips":906372},{"system_id":"tor-bikeshare","month":"2024-08","member":635241,"casual":271913,"other":0,"unlabelled":0,"trips":907154},{"system_id":"tor-bikeshare","month":"2024-09","member":649515,"casual":252123,"other":0,"unlabelled":0,"trips":901638},{"system_id":"tor-bikeshare","month":"2024-10","member":602978,"casual":191043,"other":0,"unlabelled":0,"trips":794021},{"system_id":"tor-bikeshare","month":"2024-11","member":460467,"casual":95181,"other":0,"unlabelled":0,"trips":555648},{"system_id":"tor-bikeshare","month":"2024-12","member":224318,"casual":27629,"other":0,"unlabelled":0,"trips":251947},{"system_id":"tor-bikeshare","month":"2025-01","member":187136,"casual":15810,"other":0,"unlabelled":0,"trips":202946},{"system_id":"tor-bikeshare","month":"2025-02","member":116379,"casual":9291,"other":0,"unlabelled":0,"trips":125670},{"system_id":"tor-bikeshare","month":"2025-03","member":272705,"casual":39473,"other":0,"unlabelled":0,"trips":312178},{"system_id":"tor-bikeshare","month":"2025-04","member":377480,"casual":94045,"other":0,"unlabelled":0,"trips":471525},{"system_id":"tor-bikeshare","month":"2025-05","member":511761,"casual":187700,"other":0,"unlabelled":0,"trips":699461},{"system_id":"tor-bikeshare","month":"2025-06","member":662498,"casual":318126,"other":0,"unlabelled":0,"trips":980624},{"system_id":"tor-bikeshare","month":"2025-07","member":785248,"casual":406814,"other":0,"unlabelled":0,"trips":1192062},{"system_id":"tor-bikeshare","month":"2025-08","member":751819,"casual":412878,"other":0,"unlabelled":0,"trips":1164697},{"system_id":"tor-bikeshare","month":"2025-09","member":743284,"casual":318710,"other":0,"unlabelled":0,"trips":1061994},{"system_id":"tor-bikeshare","month":"